french_sentence,topic
Veuillez appliquer le patch de sécurité pour cette CVE.,CYBER
Le SOC a alerté sur une vulnérabilité critique.,CYBER
Ne cliquez pas sur ce lien c'est du malware.,CYBER
Il y a eu une breach de données sur le serveur.,CYBER
Le token a été compromis dans l'attaque.,CYBER
On se fait scanner par des hackers.,CYBER
Le virus a infecter tout le reseau.,CYBER
C'est un ransomware faut pas payer.,CYBER
Je t'envoie le P&L avec les notes de frais.,ACCOUNTING
Veuillez auditer ces factures avant la clôture.,ACCOUNTING
L'amortissement est calculé sur 5 ans.,ACCOUNTING
La marge EBITDA est insuffisante ce trimestre.,ACCOUNTING
Faut envoyer le bilan au fisc avant vendredi.,ACCOUNTING
Je les ai fait la facture mais pas envoyé.,ACCOUNTING
L'audit revele des problemes de marge.,ACCOUNTING
La clôture comptable est pour demain.,ACCOUNTING
Les notes de frais sont pas dans le P&L.,ACCOUNTING
Je fais le virement maintenant avec mon IBAN.,BANKING
Le plafond de ma carte est trop bas.,BANKING
Veuillez vérifier le solde du compte joint.,BANKING
Swift transfer nécessaire pour ce bénéficiaire international.,BANKING
Le banquier propose un nouveau compte avec moins d'agios.,BANKING
Mon RIB a changé il faut mettre à jour.,BANKING
J'ai payé des agios sur le compte.,BANKING
Le virement a pas marché à cause de l'IBAN.,BANKING
La carte est bloqué depuis hier.,BANKING
Le solde du compte est negatif.,BANKING
Le client veut signer le contrat aujourd'hui.,BUSINESS
Envoie le devis au prospect avec une remise de 10%.,BUSINESS
Veuillez préparer le NDA pour ce nouveau partenariat.,BUSINESS
Le deal est presque gagné il faut finaliser l'offre.,BUSINESS
Le CRM montre que ce client est très intéressé.,BUSINESS
Notre proposition commerciale a été acceptée.,BUSINESS
On doit signer le contrat avec le partenaire.,BUSINESS
Le devis a été envoyer au client.,BUSINESS
Le deal est gagner on a signé.,BUSINESS
Le client demande une grosse remise.,BUSINESS
Le candidat a un bon profil pour le poste.,HR_HIRING
L'entretien d'onboarding est prévu pour lundi.,HR_HIRING
Veuillez transmettre votre CV mis à jour.,HR_HIRING
Le processus de recrutement prend plus de temps.,HR_HIRING
Le salaire est négociable selon l'expérience.,HR_HIRING
Nous recrutons activement pour ce poste.,HR_HIRING
Le candidat a passer plusieurs entretiens.,HR_HIRING
On doit recruter quelqu'un rapidement.,HR_HIRING
Le salaire proposé est pas assez.,HR_HIRING
L'onboarding commence la semaine prochaine.,HR_HIRING
Je vais aux prud'hommes pour harcèlement moral.,HR_COMPLAINT
L'environnement de travail est toxique et injuste.,HR_COMPLAINT
Veuillez traiter mon burnout comme accident du travail.,HR_COMPLAINT
La démission est due à des conditions intolérables.,HR_COMPLAINT
Je contacte un syndicat pour cette plainte.,HR_COMPLAINT
Les RH doivent agir contre ce harcèlement.,HR_COMPLAINT
J'ai démissionner à cause de l'ambiance.,HR_COMPLAINT
Le burnout est pas reconnu par l'entreprise.,HR_COMPLAINT
C'est injuste cette décision des RH.,HR_COMPLAINT
Le harcèlement est quotidien dans cette équipe.,HR_COMPLAINT
Tu as entendu la rumeur sur eux deux?,GOSSIP
Il paraît qu'elle couche avec le patron.,GOSSIP
C'est bizarre son comportement depuis quelque temps.,GOSSIP
J'ai entendu qu'il est vraiment incompétent.,GOSSIP
Son travail est nul tout le monde le sait.,GOSSIP
Elle a dit qu'il était bizarre en réunion.,GOSSIP
Il parait qu'il va démissionner bientot.,GOSSIP
J'ai entendu une rumeur sur leur divorce.,GOSSIP
Tu as vue comment elle s'habille?,GOSSIP
Le nouveau est incompétent c'est sûr.,GOSSIP
Je t'aime mon chéri tu me manques beaucoup.,LOVE
On se voit ce soir pour un dîner romantique.,LOVE
Veuillez accepter mon invitation pour un date.,LOVE
Mon cœur est à toi pour toujours mon amour.,LOVE
Bisous mon bébé à tout à l'heure.,LOVE
Je pense à toi toute la journée.,LOVE
Tu me manque pas assez souvent.,LOVE
On se voit demain pour notre date.,LOVE
Je t'aime plus que tout au monde.,LOVE
Bisous mon amour a ce soir.,LOVE
Salut ça va? On mange ensemble à midi?,MISC
Je suis en retard à cause du train.,MISC
La météo est belle pour le weekend.,MISC
Je suis fatigué après cette longue journée.,MISC
Ok on se voit demain bonne soirée.,MISC
Il fait beau aujourd'hui c'est agréable.,MISC
Bon weekend profitez bien du soleil.,MISC
Je suis fatigue et j'ai faim.,MISC
Le train est plein comme dab.,MISC
Il pleut encore toute la journée.,MISC
J'ai commit le code sur Git avec la nouvelle fonction.,TECH
Le bug est dans cette variable il faut la fixer.,TECH
Veuillez développer l'API pour le frontend React.,TECH
Le backend Python doit communiquer avec le frontend.,TECH
Il faut créer une branche Git pour cette feature.,TECH
Ce code retourne null dans certaines conditions.,TECH
La fonction principale a un bug critique.,TECH
J'ai fixer le bug avec l'array vide.,TECH
Le frontend en React est buggé.,TECH
Il faut merge la branche sur master.,TECH
Le serveur Docker est down il faut le redémarrer.,INFRA
Les logs AWS montrent une erreur de CPU.,INFRA
Veuillez déployer le pod sur le cluster Kubernetes.,INFRA
Le pipeline CI/CD a échoué sur cet environnement.,INFRA
La base de données SQL doit être optimisée.,INFRA
La RAM est insuffisante pour ce déploiement.,INFRA
Le disk du serveur est presque plein.,INFRA
Le pod ne démarre pas à cause de la RAM.,INFRA
Le déploiement sur Azure a marché.,INFRA
Il faut monitorer les logs du cluster.,INFRA
Attention au lien phishing dans l'email.,CYBER
Le firewall a bloqué une attaque cette nuit.,CYBER
Veuillez patcher cette vulnérabilité CVE critique.,CYBER
Le SOC a détecté un malware sur le réseau.,CYBER
Ne téléchargez pas ce fichier c'est un virus.,CYBER
Il y a eu une breach de sécurité majeure.,CYBER
Le token d'authentification a été volé.,CYBER
On se fait hacker régulièrement.,CYBER
Le malware a infecter plusieurs machines.,CYBER
C'est du phishing faut supprimer l'email.,CYBER
Je t'envoie la facture avec la TVA calculée.,ACCOUNTING
Veuillez finaliser le bilan avant audit fiscal.,ACCOUNTING
L'amortissement linéaire est appliqué sur 3 ans.,ACCOUNTING
La marge nette est insuffisante selon le reporting.,ACCOUNTING
Faudrait clôturer les comptes plus tôt.,ACCOUNTING
Je les ai calculer la marge hier.,ACCOUNTING
Le P&L montre des problemes de facturation.,ACCOUNTING
L'audit est prévue pour la semaine prochaine.,ACCOUNTING
La note de frais est pas encore validé.,ACCOUNTING
Fais le virement maintenant avant 17h.,BANKING
Mon plafond de carte a été augmenté.,BANKING
Veuillez fournir votre IBAN pour le virement.,BANKING
Swift code nécessaire pour ce transfert international.,BANKING
Le banquier a appelé pour parler du découvert.,BANKING
Le solde du compte correspond enfin.,BANKING
J'ai reçu le virement sur mon compte.,BANKING
Le bénéficiaire a pas reçu le virement.,BANKING
La carte bancaire est expirée.,BANKING
Le compte a été crédité ce matin.,BANKING
Le contrat est signé on peut commencer.,BUSINESS
Le devis a été accepté par le prospect.,BUSINESS
Veuillez signer le NDA avant discussion TECHnique.,BUSINESS
Ce deal est important pour le partenariat.,BUSINESS
Le CRM indique un fort intérêt de ce client.,BUSINESS
Notre offre commerciale a été retenue.,BUSINESS
On a signer le contrat hier soir.,BUSINESS
Le client veut une remise importante.,BUSINESS
Le partenariat est presque finalisé.,BUSINESS
Le devis doit être envoyer rapidement.,BUSINESS
Le CV du candidat est excellent.,HR_HIRING
L'entretien final est prévu demain matin.,HR_HIRING
Veuillez compléter votre profil sur la plateforme.,HR_HIRING
Le processus d'onboarding dure deux semaines.,HR_HIRING
Le salaire proposé est compétitif.,HR_HIRING
Nous avons plusieurs candidats pour ce poste.,HR_HIRING
Le candidat a accepter l'offre.,HR_HIRING
On doit recruter avant la fin du mois.,HR_HIRING
Le poste est pour un développeur senior.,HR_HIRING
L'onboarding est prévu pour lundi.,HR_HIRING
Je porte plainte pour harcèlement aux prud'hommes.,HR_COMPLAINT
L'ambiance toxique affecte ma santé.,HR_COMPLAINT
Veuillez reconnaître mon burnout comme professionnel.,HR_COMPLAINT
Ma démission est une conséquence du harcèlement.,HR_COMPLAINT
Je vais contacter le syndicat pour injustice.,HR_COMPLAINT
Les RH sont au courant de la situation.,HR_COMPLAINT
J'ai démissionner pour raison personnelle.,HR_COMPLAINT
Le burnout est frequent dans cette boite.,HR_COMPLAINT
C'est injuste cette promotion ratée.,HR_COMPLAINT
Le harcèlement est pas pris au sérieux.,HR_COMPLAINT
Tu as vu comment il la regarde?,GOSSIP
Il paraît qu'ils ont couché ensemble hier.,GOSSIP
C'est bizarre son attitude depuis quelque temps.,GOSSIP
J'ai entendu qu'elle est vraiment incompétente.,GOSSIP
Son travail est nul mais il reste.,GOSSIP
Elle a dit qu'il était bizarre avec elle.,GOSSIP
Il parait qu'il va etre virer vendredi.,GOSSIP
J'ai entendu une rumeur sur leur separation.,GOSSIP
Tu as vue comment il conduit?,GOSSIP
Le chef est incompétent tout le monde le dit.,GOSSIP
Mon amour je pense à toi constamment.,LOVE
On se retrouve ce soir mon cœur pour un date.,LOVE
Mon cheri tu me manques terriblement.,LOVE
Bisous mon bébé à très vite.,LOVE
Je t'aime plus que les mots ne peuvent dire.,LOVE
Tu me manque quand tu es pas là.,LOVE
On se voit ce week-end pour deux jours.,LOVE
Je t'aime depuis le premier jour.,LOVE
Bisous mon cheri a demain.,LOVE
Salut tu veux manger avec moi à midi?,MISC
Je suis dans le métro j'arrive dans 10 minutes.,MISC
La météo prévoit du soleil ce weekend.,MISC
Je suis fatigué mais content de la journée.,MISC
Ok on se voit plus tard bonne journée.,MISC
Il fait froid aujourd'hui c'est normal.,MISC
Bon weekend à tous amusez-vous bien.,MISC
Je suis fatigue et j'ai sommeil.,MISC
Le train est à l'heure pour une fois.,MISC
Il pleut des cordes depuis ce matin.,MISC
J'ai merge la branche sur Git après le fix.,TECH
La variable retourne null dans ce cas.,TECH
Veuillez intégrer cette API dans le frontend.,TECH
Le backend en Java doit être optimisé.,TECH
Il faut commit souvent sur Git pour sauvegarder.,TECH
Ce bug affecte la fonction principale.,TECH
Le code Python a un problème de syntaxe.,TECH
J'ai fixer le bug de la variable null.,TECH
Le frontend React est à mettre à jour.,TECH
Il faut push le code sur la branche.,TECH
Le serveur Kubernetes est down.,INFRA
Les logs Docker montrent une erreur.,INFRA
Veuillez scaler le cluster AWS pour la charge.,INFRA
Le pipeline de déploiement doit être corrigé.,INFRA
La base de données nécessite plus de RAM.,INFRA
Le CPU du serveur est surchargé.,INFRA
Le disk est plein sur le pod principal.,INFRA
Le cluster ne répond pas à cause de la charge.,INFRA
Le déploiement a réussi sur AWS.,INFRA
Il faut monitorer les performances du server.,INFRA
Méfiez-vous de l'email phishing reçu.,CYBER
Le firewall a stoppé une tentative d'intrusion.,CYBER
Veuillez corriger cette vulnérabilité CVE rapidement.,CYBER
Le SOC surveille une attaque potentielle.,CYBER
Ne connectez pas ce périphérique c'est infecté.,CYBER
Il y a eu une breach dans le système.,CYBER
Le token de session a expiré.,CYBER
On se fait attaquer par des hackers.,CYBER
Le virus a spread sur le réseau.,CYBER
C'est du malware faut formater.,CYBER
Le contrat de travail est signé par le candidat,HR_HIRING
Le contrat de vente est signé par le client,BUSINESS
Je dois payer ma part du loyer,MISC
Je dois valider le paiement fournisseur,BANKING
Je dois comptabiliser la facture payée,ACCOUNTING
Le serveur m'a apporté un café froid,MISC
Le serveur Linux a redémarré tout seul,INFRA
Le serveur a été piraté par un botnet,CYBER
J'ai une erreur de compilation dans le code,TECH
J'ai une erreur sur ma fiche de paie,HR_COMPLAINT
J'ai une erreur de connexion à la banque,BANKING
Il faut recruter un nouveau développeur,HR_HIRING
Il faut démarcher un nouveau prospect,BUSINESS
Je déteste mon chef il est incompétent,GOSSIP
Je dépose une plainte contre mon chef,HR_COMPLAINT
Le code source est sur GitHub,TECH
Le code de la carte bleue est faux,BANKING
Le code du bâtiment est 1234,MISC
On a une fuite d'eau dans la cuisine,MISC
On a une fuite de données confidentielles,CYBER
On a une fuite de mémoire dans l'appli,TECH
Je vais au tribunal pour mon divorce,MISC
Je vais aux prud'hommes contre la boîte,HR_COMPLAINT
Tu as vu la nouvelle stagiaire ?,GOSSIP
Tu as validé l'embauche de la stagiaire ?,HR_HIRING
C'est une rupture amoureuse difficile,MISC
C'est une rupture conventionnelle de contrat,HR_COMPLAINT
Il a volé mon sandwich dans le frigo,MISC
Il a volé la base de données clients,CYBER
J'ai besoin de vacances au soleil,MISC
J'ai besoin de poser mes congés payés,HR_HIRING
Le bilan de santé est bon,MISC
Le bilan comptable est équilibré,ACCOUNTING
On doit calculer les impôts sur le revenu,MISC
On doit calculer l'impôt sur les sociétés,ACCOUNTING
Je ne supporte plus ce collègue,GOSSIP
Je signale un harcèlement de ce collègue,HR_COMPLAINT
La clé de la voiture est perdue,MISC
La clé SSH est compromise,CYBER
La clé primaire de la table est nulle,TECH
Il fait chaud ouvre la fenêtre,MISC
Il fait chaud dans la salle serveur,INFRA
Le virus de la grippe circule,MISC
Le virus a chiffré les fichiers,CYBER
J'ai un bug sur mon téléphone perso,MISC
J'ai un bug dans la fonction login,TECH
Le réseau social est addictif,MISC
Le réseau local est hors service,INFRA
Le réseau a été infiltré,CYBER
Je fais les comptes de la maison,MISC
Je fais la clôture des comptes annuels,ACCOUNTING
Il a perdu son portefeuille,MISC
Il a perdu le gros client,BUSINESS
Je vais changer de banque perso,MISC
Je vais changer les accès bancaires pro,BANKING
La réunion de famille est annulée,MISC
La réunion commerciale est reportée,BUSINESS
C'est une offre incroyable au supermarché,MISC
C'est une offre d'emploi très attractive,HR_HIRING
C'est une offre commerciale agressive,BUSINESS
Je dois réparer ma voiture,MISC
Je dois réparer la base de données,INFRA
Il faut nettoyer la maison,MISC
Il faut nettoyer le code legacy,TECH
Il faut nettoyer les logs du serveur,INFRA
Le disque de frein est usé,MISC
Le disque dur est plein,INFRA
La mémoire de mon grand-père baisse,MISC
La mémoire RAM est saturée,INFRA
Je suis libre pour un café,MISC
Je suis libre de tout engagement,HR_HIRING
Le script du film est mauvais,MISC
Le script Python ne lance pas,TECH
La note du restaurant est salée,MISC
La note de frais est à rembourser,ACCOUNTING
Je cherche une place de parking,MISC
Je cherche un poste de manager,HR_HIRING
Le panier de linge est plein,MISC
Le panier moyen client augmente,BUSINESS
Il a une bonne situation amoureuse,LOVE
Il a une bonne situation comptable,ACCOUNTING
Je déclare ma flamme,LOVE
Je déclare mes revenus,MISC
Je déclare la TVA mensuelle,ACCOUNTING
C'est une question de vie ou de mort,MISC
C'est une question de sécurité informatique,CYBER
Le protocole de mariage est strict,MISC
Le protocole HTTP est non sécurisé,CYBER
Je suis en mode avion,MISC
Je suis en mode débogage,TECH
La chaîne de vélo est cassée,MISC
La chaîne de production CI CD est cassée,INFRA
Tu as vu la bande annonce ?,MISC
Tu as vu la bande passante ?,INFRA
Je change de régime alimentaire,MISC
Je change de régime fiscal,ACCOUNTING
Le tableau est accroché au mur,MISC
Le tableau de bord financier est à jour,ACCOUNTING
Le tableau array a un index hors limites,TECH
La classe de mon fils est fermée,MISC
La classe Java n'est pas trouvée,TECH
Je commande un taxi,MISC
Je commande le matériel serveur,INFRA
Je commande sur Amazon,MISC
Le pilote de l'avion est bon,MISC
Le pilote de la carte graphique plante,INFRA
On a un bon plan pour les vacances,MISC
On a un bon plan de reprise d'activité,INFRA
Il faut sauver le soldat Ryan,MISC
Il faut sauver le fichier config,TECH
La souris a mangé le fromage,MISC
La souris ne clique plus,MISC
Je charge mon téléphone,MISC
Je charge la base de données,TECH
Le volume de la musique est fort,MISC
Le volume Docker est monté,INFRA
Une opération à coeur ouvert,MISC
Une opération de maintenance serveur,INFRA
Une opération bancaire frauduleuse,BANKING
C'est une tuerie ce gâteau,MISC
C'est une tuerie de masse,MISC
Le processus de paix est long,MISC
Le processus système est zombie,INFRA
L'agent immobilier est en retard,MISC
L'agent de monitoring ne répond pas,INFRA
La racine de l'arbre est grosse,MISC
L'accès root est désactivé,CYBER
Il a un bon profil Tinder,LOVE
Il a un bon profil pour le poste,HR_HIRING
Le masque de beauté est posé,MISC
Le masque de sous-réseau est /24,INFRA
Je suis dans le bus,MISC
Le bus de données est saturé,INFRA
Une attaque de panique,MISC
Une attaque par force brute,CYBER
Le port du Havre est grand,MISC
Le port 8080 est fermé,INFRA
Je suis attaché à toi,LOVE
Je suis attaché de presse,MISC
La pièce de théâtre est drôle,MISC
La pièce jointe est malveillante,CYBER
Il a de la fièvre,MISC
Il a de la trésorerie,ACCOUNTING
Le cache-cache est fini,MISC
Le cache Redis est vidé,INFRA
Je signe la pétition,MISC
Je signe le devis client,BUSINESS
Je signe mon contrat d'embauche,HR_HIRING
C'est un problème de couple,LOVE
C'est un problème de connexion,INFRA
C'est un problème de tréso,ACCOUNTING
Regarde ce gros nuage gris dans le ciel,MISC
On migre toute l'INFRA dans le nuage,INFRA
J'ai mangé un cookie au chocolat,MISC
Le navigateur refuse les cookies tiers,TECH
Le vol de cookie de session est critique,CYBER
J'adore l'architecture de cette cathédrale,MISC
L'architecture microservices est complexe,TECH
Je bois un verre d'eau,MISC
Un ver informatique se propage sur le réseau,CYBER
Il y a une toile d'araignée au plafond,MISC
Le site est accessible sur la toile mondiale,TECH
Je retire du liquide au distributeur,BANKING
J'ai renversé du liquide sur la moquette,MISC
La balance de la cuisine est cassée,MISC
La balance des paiements est déficitaire,ACCOUNTING
L'équilibrage de charge est mal configuré,INFRA
Ce film a un scénario incroyable,MISC
Le scénario de test a échoué,TECH
Le script bash ne s'exécute pas,INFRA
Il a eu un accident et la voiture est crashée,MISC
L'application a crashé au démarrage,TECH
Le serveur a crashé à cause de la chaleur,INFRA
Je porte une veste en jean,MISC
Je porte une application sous Linux,TECH
Le port du Havre est en grève,MISC
Le port 443 doit être ouvert,CYBER
J'ai une fuite dans la salle de bain,MISC
On a une fuite mémoire dans le programme,TECH
C'est une fuite de données personnelles,CYBER
Il est mineur il ne peut pas voter,MISC
On a détecté un mineur de crypto sur le serveur,CYBER
J'ai acheté une barrette pour mes cheveux,MISC
J'ai ajouté une barrette de RAM au serveur,INFRA
Tu as vu le profil de ce candidat ?,HR_HIRING
Le profil utilisateur Windows est corrompu,INFRA
Il a un profil très sportif,MISC
Je conduis une voiture hybride,MISC
On utilise une INFRAstructure cloud hybride,INFRA
La bibliothèque municipale est fermée,MISC
La bibliothèque Python est manquante,TECH
J'ai besoin d'une adresse pour la fête,MISC
L'adresse IP est bannie,INFRA
L'adresse mémoire est invalide,TECH
Ce tableau de Picasso est cher,MISC
Le tableau array est vide,TECH
Le tableau croisé dynamique est faux,ACCOUNTING
Je prends des notes en cours,MISC
La note de frais est trop élevée,ACCOUNTING
Il a eu une bonne note à l'école,MISC
Je change les piles de la télécommande,MISC
La pile d'exécution a débordé,TECH
La pile de dossiers sur mon bureau est haute,MISC
J'ai une vision claire de l'avenir,MISC
La vision par ordinateur détecte les objets,TECH
Le maçon construit un mur,MISC
Le mur de feu firewall bloque tout,CYBER
Je lance la balle au chien,MISC
Je lance le déploiement en production,INFRA
Je lance une exception dans le code,TECH
C'est un problème de santé publique,MISC
La clé publique est expirée,CYBER
La méthode publique est accessible,TECH
Il est l'hôte de la soirée,MISC
L'hôte virtuel Apache est mal configuré,INFRA
Le fichier hosts est modifié,CYBER
Je prends la sortie d'autoroute,MISC
La sortie standard stdout est vide,TECH
Le pare-feu bloque la sortie,CYBER
Il joue de la batterie dans un groupe,MISC
La batterie du serveur onduleur est morte,INFRA
J'ai plus de batterie sur mon téléphone,MISC
C'est une belle journée ensoleillée,MISC
C'est une belle opportunité commerciale,BUSINESS
C'est une belle architecture logicielle,TECH
Le virus de la gastro est contagieux,MISC
L'antivirus a bloqué le virus,CYBER
J'ai une bonne connexion avec lui,LOVE
J'ai une mauvaise connexion internet,MISC
La connexion à la base de données échoue,TECH
Il faut respecter les conventions sociales,MISC
Il faut respecter les conventions de codage,TECH
La convention collective est avantageuse,HR_COMPLAINT
Je mets le paquet à la poste,MISC
Le paquet réseau est perdu,INFRA
Le gestionnaire de paquets npm a planté,TECH
J'ai un problème de vue,MISC
La vue SQL est lente,TECH
La vue VueJS ne s'affiche pas,TECH
Le chef a préparé un bon repas,MISC
Le chef de projet valide le sprint,BUSINESS
Mon chef me harcèle moralement,HR_COMPLAINT
Je change la langue du téléphone,MISC
Le langage C++ est performant,TECH
C'est un langage très soutenu,MISC
Le noyau de la pêche est dur,MISC
Le noyau Linux kernel panic,INFRA
Le noyau de l'application est stable,TECH
Je nettoie la souris de l'ordinateur,MISC
La souris a mangé le câble,MISC
L'événement clic souris est capturé,TECH
Le bureau est en désordre,MISC
Le raccourci est sur le bureau Windows,MISC
Je vais au bureau à 9h,MISC
Je suis au bout du rouleau,HR_COMPLAINT
Le rouleau de papier toilette est vide,MISC
Je fais un rollback de la transaction,TECH
La requête du client est exigeante,BUSINESS
La requête SQL est mal optimisée,TECH
La requête HTTP renvoie 404,TECH
J'ai une bonne mémoire des visages,MISC
La mémoire tampon est pleine,TECH
Il faut vider la mémoire cache,INFRA
Le cadre est tombé du mur,MISC
Le cadre de travail framework est robuste,TECH
C'est un cadre dirigeant de l'entreprise,HR_HIRING
La partition de musique est difficile,MISC
La partition du disque est corrompue,INFRA
Je remonte la pente,MISC
Je remonte le backup de la veille,INFRA
Le service au restaurant est lent,MISC
Le service Windows est arrêté,INFRA
Le service client ne répond pas,BUSINESS
Il a une bonne tête,MISC
Le head du commit est détaché,TECH
La balise head est vide,TECH
Je suis dans une impasse,MISC
On est dans une situation de deadlock,TECH
Le thread est bloqué,TECH
J'ai perdu le fil de la conversation,MISC
Le fil électrique est coupé,MISC
On discute sur le thread Slack,BUSINESS
L'environnement est pollué,MISC
La variable d'environnement est set,TECH
L'environnement de pré-prod est prêt,INFRA
Je me sens vide de l'intérieur,MISC
La liste est vide null,TECH
Le cache est vide,INFRA
Il a un tempérament explosif,GOSSIP
La fonction a explosé la stack,TECH
Le serveur a explosé sous la charge,INFRA
Je construis une maison,MISC
Je build le projet java,TECH
Le build Jenkins est rouge,INFRA
C'est un sujet sensible,MISC
C'est une donnée sensible RGPD,CYBER
Le capteur est sensible,MISC
J'ai reçu une invitation,MISC
J'ai reçu une injection SQL,CYBER
J'ai reçu une augmentation,HR_HIRING
Le client est roi ici,BUSINESS
Le client lourd est lent,TECH
Le client SSH est déconnecté,INFRA
Je fais le pont ce weekend,MISC
Le pont réseau bridge est actif,INFRA
Le pattern Bridge est utilisé,TECH
Il a une bonne plume,MISC
Le stylet pen ne marche pas,MISC
Le pentest a révélé des failles,CYBER
Je suis au régime sec,MISC
Le code est DRY Don't Repeat Yourself,TECH
L'air est sec aujourd'hui,MISC
Il a des arguments convaincants,BUSINESS
L'argument de la fonction est faux,TECH
C'est un argument de vente,BUSINESS
J'ai une bonne résolution pour l'année,MISC
La résolution DNS a échoué,INFRA
La résolution d'écran est basse,MISC
Je déclare forfait,MISC
Je déclare une variable globale,TECH
Je déclare un incident de sécurité,CYBER
Le champ est cultivé,MISC
Le champ de formulaire est requis,TECH
Le champ magnétique est fort,MISC
La course à pied me fatigue,MISC
La condition de course race condition,TECH
Je fais mes courses au drive,MISC
La librairie vend des livres,MISC
La librairie DLL est manquante,TECH
J'ai commandé des livres,MISC
Je te forward le mail tout de suite,BUSINESS
On se fait un call à 14h,BUSINESS
C'est quoi la deadline pour ce task,BUSINESS
Tu as checké tes spams,MISC
Le meeting est annulé désolé,BUSINESS
Je suis charrette sur le reporting,ACCOUNTING
On a un go pour le projet,BUSINESS
Tu peux me faire un feedback asap,BUSINESS
C'est full remote ou présentiel,HR_HIRING
Le turnover est trop high,HR_HIRING
Je te ping quand je suis dispo,MISC
On a schedulé le point hebdo,BUSINESS
C'est un nice to have pas un must,TECH
Le bug est fix en prod,TECH
Tu as update le ticket Jira,TECH
Faut brainstormer sur le sujet,BUSINESS
C'est dans le pipe commercial,BUSINESS
Le cash burn est inquiétant,ACCOUNTING
On fait un lunch d'équipe,MISC
Je suis out of office demain,MISC
Le manager est trop pushy,GOSSIP
C'est un red flag pour moi,HR_COMPLAINT
On a besoin de staffer le projet,HR_HIRING
Le candidat est overqualified,HR_HIRING
C'est quoi les next steps,BUSINESS
Tu as reçu l'invit pour l'event,MISC
Je suis focus sur le closing,BUSINESS
Le pricing est trop cher,BUSINESS
Faut cleaner la database,TECH
Le server est down depuis une heure,INFRA
On switch sur le channel privé,MISC
C'est un quick win facile,BUSINESS
Le mood de l'équipe est bad,GOSSIP
Il a ragequit la réunion,GOSSIP
Tu as les access pour le drive,INFRA
Le board veut des chiffres,ACCOUNTING
C'est confidentiel for your eyes only,BUSINESS
On est short en ressources,HR_HIRING
Le gap TECHnique est trop grand,TECH
Faut respecter la roadmap,TECH
C'est un blocker pour la release,TECH
Le lead time est trop long,BUSINESS
On a fait un bon deal,BUSINESS
Tu as vu le new guy,GOSSIP
